{
    "$schema": "https://json-schema.org/draft/2020-12/schema",
    "$defs": {
        "ulid": {
            "type": "string",
            "minLength": 26,
            "maxLength": 26,
            "pattern": "^[0-7][0-9A-HJKMNP-TV-Za-hjkmnp-tv-z]{25}$"
        },
        "hash": {
            "type": "string",
            "pattern": "^[0-9a-f]{64}$"
        },
        "opaque": {
            "type": "string",
            "pattern": "^[A-Za-z0-9._:-]{1,128}$"
        },
        "timestamp": {
            "type": "string",
            "format": "date-time",
            "pattern": "^[0-9]{4}-[0-9]{2}-[0-9]{2}T[0-9]{2}:[0-9]{2}:[0-9]{2}\\.[0-9]{6}Z$"
        },
        "uint": {
            "type": "integer",
            "minimum": 0,
            "maximum": 9007199254740991
        },
        "currency": {
            "type": "string",
            "pattern": "^[A-Z]{3}$"
        },
        "currency_exponent": {
            "type": "integer",
            "minimum": 0,
            "maximum": 9
        },
        "edge_request_id": {
            "type": "string",
            "pattern": "^[A-Za-z0-9_+=/-]{1,128}$"
        },
        "nullable_uint": {
            "type": [
                "integer",
                "null"
            ],
            "minimum": 0,
            "maximum": 9007199254740991
        },
        "http_status": {
            "type": "integer",
            "minimum": 100,
            "maximum": 599
        },
        "edge_status": {
            "oneOf": [
                {
                    "const": 0
                },
                {
                    "type": "integer",
                    "minimum": 100,
                    "maximum": 599
                }
            ]
        },
        "bool": {
            "type": "boolean"
        }
    },
    "type": "object",
    "additionalProperties": false,
    "required": [
        "schema",
        "export_id",
        "workspace_id",
        "delivery_id",
        "mode",
        "privacy_mode",
        "created_at",
        "key_id",
        "signature_algorithm",
        "full_head",
        "event_count",
        "snapshot_sha256",
        "segments",
        "artifacts",
        "coverage"
    ],
    "properties": {
        "schema": {
            "const": "myproof.evidence.collection.v1"
        },
        "export_id": {
            "$ref": "#/$defs/ulid"
        },
        "workspace_id": {
            "$ref": "#/$defs/ulid"
        },
        "delivery_id": {
            "$ref": "#/$defs/ulid"
        },
        "mode": {
            "enum": [
                "demo",
                "test",
                "live"
            ]
        },
        "privacy_mode": {
            "enum": [
                "masked",
                "full_private"
            ]
        },
        "created_at": {
            "$ref": "#/$defs/timestamp"
        },
        "key_id": {
            "$ref": "#/$defs/opaque"
        },
        "signature_algorithm": {
            "const": "Ed25519"
        },
        "full_head": {
            "type": "object",
            "additionalProperties": false,
            "required": [
                "sequence",
                "sha256"
            ],
            "properties": {
                "sequence": {
                    "type": "integer",
                    "minimum": 1,
                    "maximum": 512000
                },
                "sha256": {
                    "$ref": "#/$defs/hash"
                }
            }
        },
        "event_count": {
            "type": "integer",
            "minimum": 1,
            "maximum": 512000
        },
        "snapshot_sha256": {
            "$ref": "#/$defs/hash"
        },
        "segments": {
            "type": "array",
            "minItems": 1,
            "maxItems": 1024,
            "items": {
                "type": "object",
                "additionalProperties": false,
                "required": [
                    "index",
                    "path",
                    "segment_sha256",
                    "archive_sha256",
                    "archive_size",
                    "events_sha256",
                    "events_bytes",
                    "event_count",
                    "first_sequence",
                    "last_sequence",
                    "previous_sha256",
                    "last_sha256"
                ],
                "properties": {
                    "index": {
                        "type": "integer",
                        "minimum": 1,
                        "maximum": 1024
                    },
                    "path": {
                        "type": "string",
                        "pattern": "^segment-(000[1-9]|00[1-9][0-9]|0[1-9][0-9]{2}|10[01][0-9]|102[0-4])\\.zip$"
                    },
                    "segment_sha256": {
                        "$ref": "#/$defs/hash"
                    },
                    "archive_sha256": {
                        "$ref": "#/$defs/hash"
                    },
                    "archive_size": {
                        "type": "integer",
                        "minimum": 1,
                        "maximum": 16777216
                    },
                    "events_sha256": {
                        "$ref": "#/$defs/hash"
                    },
                    "events_bytes": {
                        "type": "integer",
                        "minimum": 1,
                        "maximum": 4194304
                    },
                    "event_count": {
                        "type": "integer",
                        "minimum": 1,
                        "maximum": 500
                    },
                    "first_sequence": {
                        "type": "integer",
                        "minimum": 1,
                        "maximum": 512000
                    },
                    "last_sequence": {
                        "type": "integer",
                        "minimum": 1,
                        "maximum": 512000
                    },
                    "previous_sha256": {
                        "oneOf": [
                            {
                                "type": "null"
                            },
                            {
                                "$ref": "#/$defs/hash"
                            }
                        ]
                    },
                    "last_sha256": {
                        "$ref": "#/$defs/hash"
                    }
                }
            }
        },
        "artifacts": {
            "type": "array",
            "minItems": 1,
            "maxItems": 16,
            "items": {
                "type": "object",
                "additionalProperties": false,
                "required": [
                    "name",
                    "sha256",
                    "size"
                ],
                "properties": {
                    "name": {
                        "type": "string",
                        "pattern": "^[a-z0-9][a-z0-9_-]{0,63}\\.(json|html|pdf|txt)$",
                        "not": {
                            "enum": [
                                "segment.json",
                                "collection.json"
                            ]
                        }
                    },
                    "sha256": {
                        "$ref": "#/$defs/hash"
                    },
                    "size": {
                        "type": "integer",
                        "minimum": 0,
                        "maximum": 8388608
                    }
                }
            },
            "contains": {
                "properties": {
                    "name": {
                        "const": "snapshot.json"
                    }
                }
            },
            "minContains": 1,
            "maxContains": 1
        },
        "coverage": {
            "type": "array",
            "minItems": 6,
            "maxItems": 6,
            "items": {
                "type": "object",
                "additionalProperties": false,
                "required": [
                    "source",
                    "status",
                    "limitation"
                ],
                "properties": {
                    "source": {
                        "enum": [
                            "app",
                            "merchant",
                            "stripe",
                            "ses",
                            "cloudfront",
                            "client"
                        ]
                    },
                    "status": {
                        "enum": [
                            "observed",
                            "pending",
                            "unavailable"
                        ]
                    },
                    "limitation": {
                        "type": "string",
                        "minLength": 1,
                        "maxLength": 512
                    }
                }
            }
        }
    },
    "title": "MyProof complete evidence collection v1",
    "$comment": "Structural schema only. Strict canonical byte/token profile, UTF-8 byte bounds, summed artifact bounds, unique names/sources, range arithmetic, ordered descriptors, path/index equality, original v2 chain checks, digest and signature verification are mandatory protocol checks."
}
