{"artifacts":[{"name":"snapshot.json","sha256":"c2a1939e58d3f7713ad7a724c33385cdd8b466d2de2d9535c64ef4ba10b80672","size":309}],"coverage":[{"limitation":"Fixture observations only; missing and late events remain unknown.","source":"app","status":"observed"},{"limitation":"Fixture observations only; missing and late events remain unknown.","source":"merchant","status":"observed"},{"limitation":"Fixture observations only; missing and late events remain unknown.","source":"stripe","status":"unavailable"},{"limitation":"Fixture observations only; missing and late events remain unknown.","source":"ses","status":"unavailable"},{"limitation":"Fixture observations only; missing and late events remain unknown.","source":"cloudfront","status":"observed"},{"limitation":"Fixture observations only; missing and late events remain unknown.","source":"client","status":"observed"}],"created_at":"2026-10-12T12:06:00.000000Z","delivery_id":"01K6R000000000000000000002","event_count":8,"export_id":"01K6R000000000000000000099","full_head":{"sequence":8,"sha256":"2ebace98b45672934ee31acccd1b3a4a238bd238e7b0f7800a42e10bfba36caf"},"key_id":"collection-test-2026","mode":"test","privacy_mode":"masked","schema":"myproof.evidence.collection.v1","segments":[{"archive_sha256":"3d7cbba8d119dc6ba779ac1620d5db0c50dd05cc078e834f957224748e91ffab","archive_size":2139,"event_count":3,"events_bytes":1786,"events_sha256":"00d969236ee4fdc59674fb55cf4ef9395eb44c4758b7ab8e2386f1aa4973d81a","first_sequence":1,"index":1,"last_sequence":3,"last_sha256":"2406a67097cfc57745e3003b9697905846d09565f93e8c87740f60c1f9961ec7","path":"segment-0001.zip","previous_sha256":null,"segment_sha256":"740d7884e6692188c50bcd1c718cb52e79167f252f6d6003d1abc2c84d655d43"},{"archive_sha256":"b8b652683c45ec96f3c40c9d1c4ec12b21b9b0ae03cf04c52bfb3ffe2e336c10","archive_size":2270,"event_count":3,"events_bytes":1796,"events_sha256":"655a1d401dc78af312e47aed3976557e1f83d88854b7e63448a4a0c7994765d5","first_sequence":4,"index":2,"last_sequence":6,"last_sha256":"565a51d867c7499eb4916bd3a3d91dfd5ae83c9cd29b90365f5460a5029016cf","path":"segment-0002.zip","previous_sha256":"2406a67097cfc57745e3003b9697905846d09565f93e8c87740f60c1f9961ec7","segment_sha256":"b923abb3d25d38170db0a685c52ec14fd34d70cebb0e897d0261127d5b378597"},{"archive_sha256":"98d001ad4ac90fed82091b8b41eb917f6d688e41ac9ea5b2a4a1ede5999e1e3a","archive_size":2547,"event_count":2,"events_bytes":2203,"events_sha256":"492dcf9154e41ddb33e7ed97d7c59828aec81fdeb04429b6dde54d3e8edbda92","first_sequence":7,"index":3,"last_sequence":8,"last_sha256":"2ebace98b45672934ee31acccd1b3a4a238bd238e7b0f7800a42e10bfba36caf","path":"segment-0003.zip","previous_sha256":"565a51d867c7499eb4916bd3a3d91dfd5ae83c9cd29b90365f5460a5029016cf","segment_sha256":"df04b73d21920316dbf1c6c0365701de9df858f210c1f8bed2affc6c003aef0c"}],"signature_algorithm":"Ed25519","snapshot_sha256":"c2a1939e58d3f7713ad7a724c33385cdd8b466d2de2d9535c64ef4ba10b80672","workspace_id":"01K6R000000000000000000001"}